<?xml version="1.0" encoding="UTF-8" standalone="yes"?><?xml-stylesheet type='text/xsl' href='history.xsl'?>
<history xmlns:xsi="http://www.w3.org/2001/XMLSchema-instance" owner="aa@gmail.com" xsi:noNamespaceSchemaLocation="history.xsd">
    <message>
        <from>we@gmail.com</from>
        <to>aa@gmail.com</to>
        <size>0</size>
        <body>oio</body>
    </message>
    <message>
        <from>we@gmail.com</from>
        <to>aa@gmail.com</to>
        <size>0</size>
        <body>klkkl</body>
    </message>
    <message>
        <from>we@gmail.com</from>
        <to>aa@gmail.com</to>
        <size>0</size>
        <body>hi </body>
    </message>
    <message>
        <from>we@gmail.com</from>
        <to>aa@gmail.com</to>
        <size>0</size>
        <body>ahmed </body>
    </message>
    <message>
        <from>we@gmail.com</from>
        <to>aa@gmail.com</to>
        <size>0</size>
        <body>fgghyyuuy</body>
    </message>
    <message>
        <from>we@gmail.com</from>
        <to>aa@gmail.com</to>
        <size>0</size>
        <body>hhg</body>
    </message>
    <message>
        <from>we@gmail.com</from>
        <to>aa@gmail.com</to>
        <size>0</size>
        <body>hhjjjjjjjjjjjjjjjjjjjjjjjjjjjjjjjjj</body>
    </message>
    <message>
        <from>we@gmail.com</from>
        <to>aa@gmail.com</to>
        <size>0</size>
        <body>uiiiiiiiiiiiiiiiii</body>
    </message>
    <message>
        <from>aa@gmail.com</from>
        <to>we@gmail.com</to>
        <size>0</size>
        <body>uiiiiiiiiiiiiiiiiiiiiiiiiiiiiiiiiiiiiiiiiiiiiiiiiiiiiiiiiiiiiiiiiiiiiiiiiiiiiiiiiiiiiiiiiiiiiiiiiiiiiiiiiiiiiiiiiiiiiiiiiiii</body>
    </message>
    <message>
        <from>aa@gmail.com</from>
        <to>we@gmail.com</to>
        <size>0</size>
        <body>ssdd</body>
    </message>
    <message>
        <from>aa@gmail.com</from>
        <to>we@gmail.com</to>
        <size>0</size>
        <body>jhkjhjh</body>
    </message>
</history>
